,Sweden_14,SE,The Swedish Privacy Agency,11-12-2024,COMPLAINT,N,,N,,NOT_DISCUSSED,1,Granit Bostad Beritsholm AB,Controller,S.11 - Non-financial corporations,"Code: 6810, Description: Real estate activities with own or leased property, Level: 4",BUSINESS,N,,N,None_Mentioned,Legitimate_Interest,,,Not_Assessed,Not_Discussed,,1 November 2022 to 11 December 2024,,Not_Assessed,Not_Evaluated,Not_Evaluated,N,,Violated,"Art. 6(1), Art. 13, Art. 5(1)(c), Art. 5(2)","Art. 6(1), Art. 13",N,Y,Y,Not_Assessed,Cooperative,During_Investigation,Not_Assessed,Not_Assessed,Mitigating_Factor,"Fine, Compliance_Order",200000,SEK,Y,Y,"IMY found that Granit Bostad Beritsholm AB conducted extensive camera surveillance in a Malmö residential property without a valid legal basis except for the garage, and failed to provide required Article 13 information. It imposed a SEK 200,000 administrative fine and ordered the company to cease surveillance in all areas except the garage and to add identity and contact details to signage within four weeks. IMY’s reasoning balanced legitimate interest against privacy, finding necessity but an unfavorable balance in entrances, stairwells and other areas, noted transparency deficiencies, and characterized the conduct as negligent with low overall seriousness.",17200.0,,,1.0,,1.0,,,,,,,,,,,,0,0,0,0,0,0,0,0,0,0,0,0,0,0,0,0,0,0,0,0,1,0,0,0,0,0,0,0,0,0,0,0,0,0,0,0,1,0,1,0,0,0,0,0,0,0.0,0.0,,,,,,,,0.0,0.0,0,1.0,1.0,,1.0,1.0,,,1.0,1.0,0.0,0,1,0,0,0,1,0,0,0,0,0,0,0,0,0,0,0,1,0,0,0,0,0,0,1,0,0,1,0,0,0,0,0,1,0,0,0,1,0,0,0,1,0,1,0,0,1,0,0,0,0,0,1,0,0,0,0,1,0,0,0,1,0,0,0,0,0,1,0,1,0,0,0,0,0,0,0,0,0,0,1,0,0
,Sweden_15,SE,Swedish Data Protection Authority (IMY),28-04-2025,COMPLAINT,Y,Lead_Authority,N,,DISCUSSED_NO_PRIOR_FOUND,1,Aller Media AB,Controller,S.11 - Non-financial corporations,,BUSINESS,N,,Y,None_Mentioned,"Consent, Legitimate_Interest",,,Not_Assessed,Not_Discussed,1,On 21 May 2021,Not_Assessed,Not_Assessed,Not_Evaluated,Not_Evaluated,N,,Not_Evaluated,"Art. 6(1)(f), Art. 5(2), Art. 24",Art. 6(1)(f),N,Y,Not_Assessed,Not_Assessed,Cooperative,During_Investigation,Not_Assessed,Not_Assessed,Mitigating_Factor,Reprimand,0,,N,,"IMY investigated a cross-border complaint about Aller Media AB’s cookie banner and subsequent processing on recept.se on 21 May 2021. IMY found Aller had not demonstrated a legitimate interest for profiling and precise geodata processing and that objection was only possible after refusing consent, violating Article 6(1)(f) GDPR. Considering the minor nature, prior clean record, and changes made during supervision, IMY issued a reprimand.",,,,1.0,,,,,,,,,,,,,,0,0,0,0,0,0,0,0,0,0,0,0,0,0,0,0,0,1,0,0,1,0,0,0,0,0,0,0,0,0,0,0,0,0,0,0,0,0,0,0,0,0,0,1,0,0.0,1.0,,,,,,,,0.0,,0,1.0,,,1.0,1.0,,,0.0,,1.0,0,1,0,0,0,1,0,0,0,0,0,0,0,0,0,1,0,1,0,0,0,0,0,0,1,0,0,1,0,0,0,1,0,0,0,0,0,1,0,1,0,0,0,1,0,0,1,0,0,0,0,0,1,0,0,0,0,1,0,0,0,1,0,0,0,0,0,0,0,1,0,0,0,0,1,0,0,0,0,1,0,0,0
,Sweden_16,SE,Swedish Authority for Privacy Protection,19-12-2024,COMPLAINT,Y,Lead_Authority,N,,DISCUSSED_NO_PRIOR_FOUND,1,Aktiebolaget Trav och Galopp,Controller,,,BUSINESS,N,,Y,None_Mentioned,Consent,,,Not_Assessed,Not_Discussed,,,Not_Assessed,Not_Assessed,Not_Evaluated,Not_Evaluated,N,,Not_Evaluated,"Art. 6, Art. 7(3), Art. 5(1)","Art. 6, Art. 7(3)",N,Y,Not_Assessed,Not_Assessed,Not_Discussed,During_Investigation,N,Not_Assessed,Mitigating_Factor,Reprimand,0,,N,,"IMY upheld a cross-border complaint against ATG, finding that its cookie banner used misleading design and did not make withdrawal of consent as easy as giving it, invalidating consent. IMY concluded violations of GDPR Art. 6 and 7(3), noting transparency concerns in the consent context. Given minor infringements and some remedial steps by ATG, IMY issued a reprimand without a fine.",,,,1.0,,,,,,,,,,,,,,0,0,0,0,0,0,0,0,0,0,0,0,0,0,0,0,0,1,0,0,0,0,0,0,0,0,0,0,0,0,0,0,0,0,0,0,0,0,0,0,0,0,0,1,0,0.0,1.0,,,,,,,,0.0,,0,1.0,,,,1.0,0.0,,0.0,,1.0,0,1,0,0,0,1,0,0,0,0,0,0,0,0,0,1,0,1,0,0,0,0,0,0,1,0,0,1,0,0,0,1,0,0,0,0,0,1,0,1,0,0,0,1,0,0,0,1,0,0,0,0,1,0,0,0,1,0,0,0,0,1,0,0,0,0,0,0,0,1,0,0,0,0,1,0,0,0,0,1,0,0,0
,Sweden_18,SE,Integritetsskyddsmyndigheten,09-06-2021,COMPLAINT,N,,N,,NOT_DISCUSSED,1,The Executive Board of the Rescue Service Östra Skaraborg,Controller,S.13 - General government,"Code: 8423, Description: Public order and safety activities, Level: 4",PUBLIC_AUTHORITY,N,,N,Employees,Public_Task,,,Not_Assessed,Y,,25 May 2018 to 6 May 2021,Not_Assessed,Not_Assessed,Inadequate,Violated,N,,Not_Evaluated,"Art. 5(1)(a), Art. 5(1)(c), Art. 6, Art. 32(1), Art. 32(4)","Art. 5(1)(a), Art. 5(1)(c), Art. 32(1), Art. 32(4)",N,N,Not_Assessed,Not_Assessed,Cooperative,During_Investigation,Not_Assessed,Not_Assessed,Mitigating_Factor,Fine,350000,SEK,N,Partially,"IMY fined the Executive Board of the Rescue Service Östra Skaraborg for camera surveillance in fire station carriage halls that captured staff during changing. IMY upheld Public Task as the legal basis but found violations of fairness and data minimization (Art. 5(1)(a), 5(1)(c)) and inadequate organizational measures under Art. 32 due to lack of instructions and 24/7 monitoring without masking. Surveillance ended on 6 May 2021 and a SEK 350,000 fine was imposed.",30100.0,,,,,,1.0,,,,1.0,,,,,,,0,0,0,0,0,0,0,0,0,0,0,0,0,1,0,0,0,0,0,0,0,1,0,0,0,0,0,0,0,0,0,0,0,0,0,0,0,0,1,0,0,0,0,0,0,0.0,0.0,,,1.0,,,0.0,0.0,0.0,,0,0.0,,,1.0,1.0,,,0.0,,0.0,0,1,0,0,0,0,0,0,0,1,0,0,0,0,0,1,0,1,0,0,0,0,0,1,0,0,0,0,0,1,0,1,0,0,1,0,0,0,0,1,0,0,0,1,0,0,1,0,0,0,0,0,1,0,0,0,0,1,0,0,0,1,0,0,0,0,1,0,0,1,0,0,0,0,0,0,0,0,0,0,1,0,0
,Sweden_20,SE,Privacy Protection Authority (IMY),28-03-2022,EX_OFFICIO_INVESTIGATION,N,,N,,NOT_DISCUSSED,1,Klarna Bank AB,Controller,S.122 - Deposit-taking corporations except the central bank,"Code: 6419, Description: Other monetary intermediation, Level: 4",BUSINESS,N,,N,None_Mentioned,"Contract, Legal_Obligation, Legitimate_Interest",Y,"Adequacy_Decision, Standard_Contractual_Clauses",Not_Assessed,Not_Discussed,,17 March 2020 to 26 June 2020,Not_Assessed,Not_Assessed,Not_Evaluated,Not_Evaluated,N,,Violated,"Art. 5(1)(a), Art. 5(2), Art. 12(1), Art. 13(1)(c), Art. 13(1)(e), Art. 13(1)(f), Art. 13(2)(a), Art. 13(2)(b), Art. 13(2)(f), Art. 14(2)(g), Art. 21(4), Art. 22(1)","Art. 5(1)(a), Art. 5(2), Art. 12(1), Art. 13(1)(c), Art. 13(1)(e), Art. 13(1)(f), Art. 13(2)(a), Art. 13(2)(b), Art. 13(2)(f), Art. 14(2)(g)",N,N,Not_Assessed,Not_Assessed,Cooperative,During_Investigation,Not_Assessed,Not_Assessed,Mitigating_Factor,Fine,7500000,SEK,N,Y,"IMY fined Klarna SEK 7.5 million for inadequate transparency in its privacy information between 17 March and 26 June 2020. Deficiencies covered purposes and legal bases, recipient disclosures, third-country transfers, retention periods, data subject rights, and meaningful information on automated decision-making, violating Arts 5, 12, 13, and 14. IMY considered the scale and seriousness, noted improvements during the investigation, and imposed a proportionate, dissuasive fine.",645000.0,,,,,1.0,1.0,,,1.0,,,,1.0,,,,0,0,0,0,0,0,0,0,0,0,0,0,0,0,0,0,0,0,1,1,1,0,0,1,0,0,0,0,1,0,0,0,0,0,0,0,0,0,1,0,0,0,0,0,0,0.0,0.0,1.0,,,,,,,0.0,0.0,0,0.0,,,1.0,1.0,,,0.0,1.0,0.0,0,1,0,0,0,1,0,0,0,0,0,0,0,0,0,1,0,1,0,0,0,0,0,0,1,0,0,1,0,0,0,0,0,1,1,0,0,0,0,1,0,0,0,1,0,0,1,0,0,0,0,0,1,0,0,0,0,1,0,0,0,1,0,0,0,0,0,1,0,0,1,0,0,0,0,0,0,0,0,0,1,0,0
,Sweden_21,SE,Swedish Privacy Protection Authority (IMY),26-06-2023,EX_OFFICIO_INVESTIGATION,N,,N,,NOT_DISCUSSED,1,Expressen Lifestyle AB,Controller,S.11 - Non-financial corporations,"Code: 5814, Description: Publishing of journals and periodicals, Level: 4",BUSINESS,,,N,None_Mentioned,"Contract, Legitimate_Interest",,,Not_Assessed,Not_Discussed,1372,May 2018 to 4 June 2019,,Not_Assessed,Not_Evaluated,Not_Evaluated,N,,Violated,"Art. 12(1), Art. 13(1)(c), Art. 6(1)(a), Art. 6(1)(b), Art. 6(1)(f)",Art. 13(1)(c),N,N,Not_Assessed,Not_Assessed,Cooperative,During_Investigation,Not_Assessed,Not_Assessed,Mitigating_Factor,Reprimand,0,,N,,"IMY investigated Bonnier Magazines’ webshop registration flow and found it stated consent as the legal basis while processing actually relied on contract or legitimate interest between May 2018 and 4 June 2019. As the company had merged, Expressen Lifestyle AB was held responsible; only 1372 customers were affected and the issue was promptly corrected, so IMY deemed the impact limited. IMY found a violation of Article 13(1)(c) and issued a reprimand.",,,,,,1.0,,,,,,,,,,,,0,0,0,0,0,0,0,0,0,0,0,0,0,0,0,0,0,0,1,0,1,0,0,0,0,0,0,0,0,0,0,0,0,0,0,0,0,0,0,0,0,0,0,1,0,,0.0,,,,,,,,0.0,0.0,0,0.0,,,1.0,1.0,,,0.0,,0.0,0,1,0,0,0,1,0,0,0,0,0,0,0,0,0,0,0,1,0,0,0,0,0,0,1,0,0,1,0,0,0,0,0,1,1,0,0,0,0,1,0,0,0,1,0,0,1,0,0,0,0,0,1,0,0,0,0,1,0,0,0,1,0,0,0,0,0,0,0,0,1,0,0,0,0,0,0,0,0,0,1,0,0
,Sweden_22,SE,Swedish Authority for Privacy Protection (IMY),12-06-2023,COMPLAINT,Y,Lead_Authority,N,,NOT_DISCUSSED,1,Spotify AB,Controller,S.11 - Non-financial corporations,,BUSINESS,N,,,None_Mentioned,Not_Specified,Y,Standard_Contractual_Clauses,Not_Assessed,Not_Discussed,,11 June 2019 to 16 May 2022; and 16 November 2021 to 16 May 2022,Not_Assessed,Not_Assessed,Not_Evaluated,Not_Evaluated,Y,Access,Violated,"Art. 12(1), Art. 12(2), Art. 12(3), Art. 15(1), Art. 15(2), Art. 15(3)","Art. 12(1), Art. 12(3), Art. 15(1)(a), Art. 15(1)(b), Art. 15(1)(c), Art. 15(1)(d), Art. 15(1)(g), Art. 15(2), Art. 15(3)",Y,Not_Evaluated,Not_Assessed,Not_Assessed,Cooperative,During_Investigation,N,Not_Assessed,Mitigating_Factor,"Fine, Reprimand, Compliance_Order",58000000,SEK,Y,Y,"IMY found Spotify’s Article 15 responses unclear and insufficient, including non-individualized information on purposes, data categories, recipients, retention, sources, and third-country safeguards, and provided technical log descriptions only in English. It upheld infringements in two complaints (late response and incomplete or insufficiently understandable copies), while a third complaint was rejected. IMY imposed a SEK 58,000,000 fine, issued a reprimand, and ordered Spotify to fulfill one complainant’s access request within one month.",4988000.0,,,,,,,1.0,,,,,,1.0,,,,0,0,0,0,0,0,0,0,0,0,0,0,0,0,0,0,0,0,0,0,0,0,0,0,0,0,0,0,1,1,0,0,0,0,0,0,1,0,1,0,0,0,0,1,0,0.0,,1.0,,,,,,,1.0,0.0,1,,,,1.0,1.0,0.0,,1.0,1.0,1.0,0,1,0,0,0,1,0,0,0,0,0,0,0,0,0,1,0,1,0,0,0,0,0,0,1,0,0,1,0,0,0,0,0,1,0,1,0,0,0,1,0,0,0,1,0,0,1,0,0,0,0,0,1,0,0,0,1,0,0,0,0,1,0,0,0,0,0,1,0,1,0,0,0,0,1,0,0,0,0,0,1,0,0
,Sweden_23,SE,Integrity Protection Authority,26-01-2022,BREACH_NOTIFICATION,N,,N,,NOT_DISCUSSED,1,The Regional Board of the Uppsala Region,Controller,S.13 - General government,,PUBLIC_AUTHORITY,Y,Health,N,"Children, Employees, Patients, Other_Vulnerable",Not_Specified,N,,Y,Not_Discussed,100000-500000,25 May 2018 to 7 May 2019,Not_Assessed,Not_Assessed,Inadequate,Not_Evaluated,N,,Not_Evaluated,"Art. 4(7), Art. 5(2), Art. 24(1), Art. 32, Art. 9(1)",Art. 32(1),N,Not_Evaluated,Not_Assessed,Not_Assessed,Cooperative,During_Investigation,Not_Assessed,Not_Assessed,Mitigating_Factor,Fine,300000,SEK,N,Y,"IMY found that the Regional Board of the Uppsala Region sent unencrypted Excel files containing sensitive health data and social security numbers via email within the region, breaching Article 32(1) GDPR. Despite transport encryption (TLS 1.2), the file contents were readable after transfer, posing high risk, and the practice violated the region’s own guidelines. Considering the systematic, long-lasting processing affecting up to 500,000 individuals and limited mitigating factors, IMY imposed a SEK 300,000 administrative fine.",25800.0,,,,,,,,,,1.0,,,,,,,0,0,0,1,0,0,0,0,0,0,0,1,0,1,1,1,0,0,0,0,0,0,0,0,0,0,0,0,0,0,0,0,0,0,0,0,0,0,1,0,0,0,0,0,0,1.0,0.0,0.0,1.0,,,,0.0,,0.0,,0,,,,1.0,1.0,,,0.0,1.0,0.0,0,1,0,0,0,0,0,0,0,1,0,0,0,0,0,1,0,1,0,0,0,0,0,1,0,0,0,1,0,0,0,1,0,0,0,1,0,0,0,1,0,0,0,1,0,0,1,0,0,0,0,0,1,0,0,0,0,1,0,0,0,1,0,0,0,0,0,1,1,0,0,0,0,0,0,0,0,0,0,0,1,0,0
,Sweden_24,SE,Swedish Data Protection Authority (IMY),26-06-2023,EX_OFFICIO_INVESTIGATION,Y,Lead_Authority,N,,NOT_DISCUSSED,1,Bonnier News AB,Joint_Controller,S.11 - Non-financial corporations,"Code: 5813, Description: Publishing of newspapers, Level: 4",BUSINESS,N,,Y,None_Mentioned,Legitimate_Interest,,,Not_Assessed,Not_Discussed,,7 November 2019 to 11 June 2020,,Not_Assessed,Not_Evaluated,Not_Evaluated,N,,Not_Evaluated,"Art. 4(1), Art. 4(4), Art. 5(1)(a), Art. 5(1)(c), Art. 6(1), Art. 26",Art. 6(1),Y,Y,Not_Assessed,Not_Assessed,Cooperative,Before_Investigation,,Y,Mitigating_Factor,Fine,13000000,SEK,Y,Partially,"IMY found Bonnier News AB, as joint controller in group-wide databases, lacked a valid legal basis under Art. 6(1) for profiling to deliver customized ads and for sharing contact details for telemarketing when profiles were supplemented. The processing used cookies-derived behavioral data linked with KDB and third-party data, and IMY rejected reliance on legitimate interest, imposing a SEK 13,000,000 fine after cross-border cooperation. Some non-linked KDB marketing was accepted under legitimate interest; mitigation included data minimization and limited retention.",1118000.0,,,1.0,,,,,,,,,,,,,,0,0,0,0,0,0,0,0,0,0,0,0,0,0,0,0,0,0,0,0,1,0,0,0,0,0,0,0,0,0,0,0,0,0,0,0,0,0,1,0,0,0,0,0,0,0.0,1.0,,,,,,,,0.0,,1,1.0,,,1.0,1.0,,1.0,1.0,,1.0,0,0,1,0,0,1,0,0,0,0,0,0,0,0,0,0,0,1,0,0,0,0,0,0,1,0,0,1,0,0,0,1,0,0,0,0,0,1,0,1,0,0,0,1,0,0,1,0,0,0,0,1,0,0,0,0,0,0,0,0,0,0,0,1,0,0,1,0,0,0,1,0,0,0,1,0,0,0,0,0,1,0,0
,Sweden_26,SE,Privacy Protection Authority (IMY),31-03-2021,COMPLAINT,Y,Lead_Authority,N,,NOT_DISCUSSED,1,Klarna Bank AB,Controller,S.12 - Financial corporations,"Code: 6419, Description: Other monetary intermediation, Level: 4",BUSINESS,,,,None_Mentioned,Not_Specified,,,Not_Assessed,Not_Discussed,1,More than five months,Not_Assessed,Not_Assessed,Not_Evaluated,Not_Evaluated,Y,Access,Not_Evaluated,"Art. 12(3), Art. 12(6), Art. 15, Art. 58(2), Art. 83",Art. 12(3),N,Not_Evaluated,Not_Assessed,Not_Assessed,Not_Discussed,Not_Discussed,Not_Assessed,Not_Assessed,Not_Considered,Reprimand,0,EUR,N,,"IMY, acting as lead authority in a cross-border case, investigated two access requests to Klarna Bank AB under GDPR Articles 12 and 15. It found a breach of Article 12(3) for complaint 1 due to a delay of more than five months without notifying the extension, and issued a reprimand; complaint 2 was handled within 14 days and required no further action. IMY used Chapter VII cooperation with several DPAs and classified the infringement as minor under Recital 148.",0.0,,,,,,,,,,,,,1.0,,,,0,0,0,0,0,0,0,0,0,0,0,0,0,0,0,0,0,0,0,0,0,0,0,0,0,0,0,0,0,1,0,0,0,0,0,0,0,0,0,0,0,0,0,1,0,,,,,,,,,,1.0,,0,,,,,,,,0.0,,1.0,0,1,0,0,0,1,0,0,0,0,0,0,0,0,0,1,0,1,0,0,0,0,0,0,1,0,0,1,0,0,0,1,0,0,0,1,0,0,0,1,0,0,0,1,0,0,0,1,0,0,0,0,0,0,1,0,0,1,0,0,0,1,0,0,0,0,0,0,0,1,0,0,0,0,1,0,0,0,0,0,1,0,0
,Sweden_27,SE,Integrity Protection Authority,22-01-2021,COMPLAINT,Y,Lead_Authority,N,,NOT_DISCUSSED,1,MAG Interactive AB,Controller,S.11 - Non-financial corporations,,BUSINESS,,,,None_Mentioned,Not_Specified,,,Not_Assessed,Not_Discussed,1,29 May 2019 until 6 November 2020,Not_Assessed,Not_Assessed,Not_Evaluated,Not_Evaluated,Y,Erasure,Violated,"Art. 12(3), Art. 12(6), Art. 17(1)(a), Art. 17(3)(b), Art. 56, Art. 57(1)(f)",Art. 12(3),N,Not_Evaluated,Not_Assessed,Not_Assessed,Cooperative,During_Investigation,Not_Assessed,Not_Assessed,Mitigating_Factor,,0,EUR,N,,"IMY, acting as lead authority in a cross-border complaint, found that MAG Interactive AB violated Article 12(3) by failing to inform the complainant of the outcome of an erasure request from 29 May 2019 until 6 November 2020. The company erased the data within 16 days and was justified in retaining minimal records to evidence compliance, but due to oversight did not notify the complainant. Considering measures taken and planned, IMY closed the case without action.",0.0,,,,,,,,,,,,,1.0,,,,0,0,0,0,0,0,0,0,0,0,0,0,0,0,0,0,0,0,0,0,0,0,0,0,0,0,0,0,0,0,0,1,0,0,0,0,0,0,0,0,0,0,0,0,0,,,,,,,,,,1.0,0.0,0,,,,1.0,1.0,,,0.0,,1.0,0,1,0,0,0,1,0,0,0,0,0,0,0,0,0,1,0,1,0,0,0,0,0,0,1,0,0,1,0,0,0,0,0,1,0,1,0,0,0,1,0,0,0,1,0,0,1,0,0,0,0,0,1,0,0,0,0,1,0,0,0,1,0,0,0,0,0,0,0,1,0,0,0,0,1,0,0,0,0,0,1,0,0
,Sweden_29,SE,Swedish Authority for Privacy Protection,01-04-2022,COMPLAINT,Y,Lead_Authority,N,,DISCUSSED_NO_PRIOR_FOUND,1,Readly AB,Controller,S.11 - Non-financial corporations,,BUSINESS,N,,,None_Mentioned,Contract|Legitimate_Interest,,,Not_Assessed,Not_Discussed,1,23 days,Not_Assessed,Not_Assessed,Not_Evaluated,Not_Evaluated,Y,Objection,Not_Evaluated,"Art. 6(1), Art. 12(3), Art. 21(2), Art. 21(3)","Art. 6(1), Art. 12(3), Art. 21(3)",N,Y,Y,Not_Assessed,Cooperative,Before_Investigation,Not_Assessed,Not_Assessed,Mitigating_Factor,Reprimand,0,,N,Partially,"IMY found Readly AB sent direct marketing emails after the complainant objected, violating Articles 21(3), 12(3), and 6(1) GDPR. It rejected contract as a lawful basis for personalized marketing emails and held that after objection no lawful basis remained. Considering the short duration, non-sensitive data, and negligent nature with remedial action, IMY issued a reprimand.",,,,1.0,1.0,,,,,,,,,1.0,,,,0,0,0,0,0,0,0,0,0,0,0,0,0,0,0,0,0,0,0,0,0,0,0,0,0,0,0,0,0,0,0,0,1,0,0,0,0,0,0,0,0,0,0,1,0,0.0,,,,,,,,,1.0,,0,1.0,1.0,,1.0,1.0,,,0.0,,1.0,0,1,0,0,0,1,0,0,0,0,0,0,0,0,0,1,0,1,0,0,0,0,0,0,1,0,0,1,0,0,0,1,0,0,0,0,0,1,0,0,0,1,0,1,0,0,1,0,0,0,0,1,0,0,0,0,0,1,0,0,0,1,0,0,0,0,1,0,0,1,0,0,0,0,1,0,0,0,0,1,0,0,0
,Sweden_30,SE,The Swedish Data Protection Authority,31-03-2023,COMPLAINT,Y,Lead_Authority,N,,DISCUSSED_NO_PRIOR_FOUND,1,CDON AB,Controller,S.11 - Non-financial corporations,"Code: 4791, Description: Retail sale via mail order houses or via Internet, Level: 4",BUSINESS,N,,N,None_Mentioned,Not_Specified,,,Not_Assessed,Not_Discussed,5,,Not_Assessed,Not_Assessed,Not_Evaluated,Violated,Y,"Erasure, Access",Not_Evaluated,"Art. 5(1)(c), Art. 5(2), Art. 11(2), Art. 12(2), Art. 12(6), Art. 17","Art. 5(1)(c), Art. 12(6), Art. 12(2)",N,Not_Evaluated,Not_Assessed,Not_Assessed,Cooperative,Before_Investigation,N,Not_Assessed,Mitigating_Factor,Reprimand,0,,N,,"IMY investigated seven cross-border complaints that CDON AB made erasure requests unduly burdensome by demanding excessive identity-verification data. It found violations of data minimization and Article 12 obligations, while noting CDON’s later procedure was proportionate. Considering the minor, older infringements and improvements, IMY issued a reprimand without a fine.",,,,,,,1.0,,,,,,,1.0,,,,0,0,0,0,0,0,0,0,0,0,0,0,0,0,0,0,0,0,0,0,0,0,0,0,0,0,0,0,0,1,0,1,0,0,0,0,0,0,0,0,0,0,0,1,0,0.0,0.0,,,,,,,0.0,1.0,,0,,,,1.0,1.0,0.0,,0.0,,1.0,0,1,0,0,0,1,0,0,0,0,0,0,0,0,0,1,0,1,0,0,0,0,0,0,1,0,0,0,0,1,0,1,0,0,0,1,0,0,0,1,0,0,0,1,0,0,1,0,0,0,0,1,0,0,0,0,1,0,0,0,0,1,0,0,0,0,0,0,0,1,0,0,0,0,1,0,0,0,0,1,0,0,0
,Sweden_31,SE,The Integrity Protection Authority,23-03-2021,COMPLAINT,Y,Lead_Authority,N,,NOT_DISCUSSED,1,Rebtel Networks AB,Controller,S.11 - Non-financial corporations,,BUSINESS,N,,,None_Mentioned,Not_Specified,,,Not_Assessed,Not_Discussed,1,18 September 2019 to 9 November 2020,Not_Assessed,Not_Assessed,Not_Evaluated,Not_Evaluated,Y,Erasure,Violated,"Art. 12(3), Art. 17(1)(a), Art. 17(3)(b)","Art. 17, Art. 12(3)",N,Not_Evaluated,Not_Assessed,Not_Assessed,Cooperative,During_Investigation,Not_Assessed,Not_Assessed,Mitigating_Factor,Reprimand,0,,N,N,"IMY investigated Rebtel Networks AB after a cross-border complaint about continued emails and failure to promptly erase data. IMY found violations of Article 17 for delayed erasure and Article 12(3) for providing incorrect information, noting four emails sent shortly after the erasure request. Considering the minor nature and remedial measures, IMY issued a reprimand.",,,,,,,,,1.0,,,,,1.0,,,,0,0,0,0,0,0,0,0,0,0,0,0,0,0,0,0,0,0,0,0,0,0,0,0,0,0,0,0,0,0,0,1,0,0,0,0,0,0,0,0,0,0,0,1,0,0.0,,,,,,,,,1.0,0.0,0,,,,1.0,1.0,,,0.0,0.0,1.0,0,1,0,0,0,1,0,0,0,0,0,0,0,0,0,1,0,1,0,0,0,0,0,0,1,0,0,1,0,0,0,0,0,1,0,1,0,0,0,1,0,0,0,1,0,0,1,0,0,0,0,0,1,0,0,0,0,1,0,0,0,1,0,0,1,0,0,0,0,1,0,0,0,0,1,0,0,0,0,0,1,0,0
,Sweden_32,SE,Swedish Authority for Privacy Protection (IMY),27-06-2022,COMPLAINT,Y,Lead_Authority,N,,DISCUSSED_NO_PRIOR_FOUND,1,Nordax Bank AB,Controller,S.12 - Financial corporations,"Code: 6419, Description: Other monetary intermediation, Level: 4",BUSINESS,N,,N,None_Mentioned,Legal_Obligation,,,Not_Assessed,Not_Discussed,1,,Not_Assessed,Not_Assessed,Not_Evaluated,Not_Evaluated,Y,Access|Erasure|Objection,Violated,"Art. 12(3), Art. 12(6), Art. 15, Art. 17, Art. 21(2)","Art. 12(3), Art. 12(6), Art. 15, Art. 17",N,Not_Evaluated,Not_Assessed,Not_Assessed,Not_Discussed,During_Investigation,N,Not_Assessed,Mitigating_Factor,"Reprimand, Compliance_Order",0,,N,,"Cross-border complaint from Norway about Nordax Bank’s handling of data subject rights for direct marketing. IMY found violations of Articles 12(3), 12(6), 15, and 17 for failing to provide access/erasure and accurate, timely information on objection handling. IMY issued a reprimand and compliance orders to provide access, assess erasure, and inform the complainant, noting minor infringement and remedial steps taken.",,,,,,,,1.0,1.0,,,,,1.0,,,,0,0,0,0,0,0,0,0,0,0,0,0,0,0,0,0,0,0,0,1,0,0,0,0,0,0,0,0,0,0,0,0,0,0,0,0,1,0,0,0,0,0,0,1,0,0.0,0.0,,,,,,,,1.0,0.0,0,,,,,1.0,0.0,,0.0,,1.0,0,1,0,0,0,1,0,0,0,0,0,0,0,0,0,1,0,1,0,0,0,0,0,0,1,0,0,1,0,0,0,0,0,1,0,1,0,0,0,1,0,0,0,1,0,0,0,1,0,0,0,0,1,0,0,0,1,0,0,0,0,1,0,0,0,0,0,0,0,1,0,0,0,0,1,0,0,0,0,1,0,0,0
,Sweden_33,SE,Swedish Privacy Agency,30-06-2023,COMPLAINT,Y,Lead_Authority,N,,NOT_DISCUSSED,1,Coop Sverige Aktiebolag,Controller,S.11 - Non-financial corporations,,BUSINESS,N,,Y,None_Mentioned,Not_Specified,Y,Standard_Contractual_Clauses,Not_Assessed,Not_Discussed,,14-08-2020 to 30-06-2023,Not_Assessed,Not_Assessed,Inadequate,Not_Evaluated,N,,Not_Evaluated,"Art. 1(2), Art. 4(1), Art. 4(5), Art. 44, Art. 45, Art. 46",Art. 44,N,Not_Evaluated,Not_Assessed,Not_Assessed,Not_Discussed,During_Investigation,Not_Assessed,Not_Assessed,Mitigating_Factor,Compliance_Order,0,,N,Partially,"IMY found that Coop’s use of Google Analytics transferred personal data to the US without ensuring an equivalent level of protection, violating Article 44. SCCs and Google’s/Coop’s supplementary measures (including server-side container and IP anonymization) were deemed ineffective given US surveillance laws. IMY ordered compliance within one month and refrained from imposing a fine due to mitigating efforts.",,,,,,,,,,,,,,,,,,0,0,0,0,0,0,0,0,0,0,0,0,0,0,0,0,0,0,0,0,0,0,0,0,0,0,0,0,1,0,0,0,0,0,0,0,1,0,0,0,0,0,0,0,0,0.0,1.0,1.0,,,,,0.0,,0.0,,0,,,,,1.0,,,0.0,,1.0,0,1,0,0,0,1,0,0,0,0,0,0,0,0,0,1,0,1,0,0,0,0,0,1,0,0,0,1,0,0,0,1,0,0,0,1,0,0,0,1,0,0,0,1,0,0,0,1,0,0,0,0,1,0,0,0,0,1,0,0,0,1,0,0,0,0,1,0,0,1,0,0,0,0,1,0,0,0,0,0,1,0,0
,Sweden_34,SE,The Swedish Privacy Agency,30-06-2023,COMPLAINT,Y,Lead_Authority,N,,NOT_DISCUSSED,1,Dagens Industri Aktiebolag,Controller,S.11 - Non-financial corporations,,BUSINESS,N,,Y,None_Mentioned,Consent,Y,Standard_Contractual_Clauses,Not_Assessed,Not_Discussed,,14-08-2020 to 30-06-2023,Not_Assessed,Not_Assessed,Inadequate,Not_Evaluated,N,,Not_Evaluated,"Art. 4(1), Art. 4(5), Art. 4(7), Art. 4(8), Art. 44, Art. 45, Art. 46",Art. 44,N,Y,Not_Assessed,Not_Assessed,Not_Discussed,During_Investigation,Not_Assessed,Not_Assessed,Mitigating_Factor,Compliance_Order,0,EUR,N,Partially,"IMY found that Dagens Industri’s use of Google Analytics transferred personal data to the US, violating Article 44 due to unmet Chapter V conditions. SCCs and additional contractual, organizational, and technical measures were deemed insufficient to prevent access by US authorities. IMY ordered compliance (cease the GA version used unless sufficient safeguards) and, considering mitigating factors, imposed no fine.",0.0,,,,,,,,,,,,,,,,,0,0,0,0,0,0,0,0,0,0,0,0,0,0,0,0,0,1,0,0,0,0,0,0,0,0,0,0,1,0,0,0,0,0,0,0,1,0,0,0,0,0,0,0,0,0.0,1.0,1.0,,,,,0.0,,0.0,,0,1.0,,,,1.0,,,0.0,,1.0,0,1,0,0,0,1,0,0,0,0,0,0,0,0,0,1,0,1,0,0,0,0,0,1,0,0,0,1,0,0,0,1,0,0,0,0,0,1,0,1,0,0,0,1,0,0,0,1,0,0,0,0,1,0,0,0,0,1,0,0,0,1,0,0,0,0,1,0,0,1,0,0,0,0,1,0,0,0,0,0,1,0,0
,Sweden_35,SE,Swedish Authority for Privacy Protection (IMY),30-06-2023,COMPLAINT,Y,Lead_Authority,N,,NOT_DISCUSSED,1,Tele2 Sverige Aktiebolag,Controller,S.11 - Non-financial corporations,"Code: 61, Description: Telecommunications, Level: 2",BUSINESS,N,,Y,None_Mentioned,Not_Specified,Y,Standard_Contractual_Clauses,Not_Assessed,Not_Discussed,,14-08-2020 to 05-2023,Not_Assessed,Not_Assessed,Inadequate,Not_Evaluated,N,,Not_Evaluated,"Art. 1(2), Art. 4(1), Art. 4(5), Art. 44, Art. 46",Art. 44,N,Not_Evaluated,Not_Assessed,Not_Assessed,Not_Discussed,During_Investigation,Not_Assessed,Not_Assessed,Mitigating_Factor,Fine,12000000,SEK,Y,Partially,"IMY found that Tele2’s use of Google Analytics on tele2.se transferred personal data to the US without meeting Chapter V GDPR conditions, violating Article 44 between 14 August 2020 and May 2023. SCCs and additional measures (including IP truncation) were deemed ineffective against potential access by US intelligence under FISA 702. IMY, acting as lead authority following an Austrian complaint, imposed a SEK 12 million fine.",1032000.0,,,,,,,,,,,,,,,,,0,0,0,0,0,0,0,0,0,0,0,0,0,0,0,0,0,0,0,0,0,0,0,0,0,0,0,0,1,0,0,0,0,0,0,0,0,0,1,0,0,0,0,0,0,0.0,1.0,1.0,,,,,0.0,,0.0,,0,,,,,1.0,,,1.0,,1.0,0,1,0,0,0,1,0,0,0,0,0,0,0,0,0,1,0,1,0,0,0,0,0,1,0,0,0,1,0,0,0,1,0,0,0,1,0,0,0,1,0,0,0,1,0,0,0,1,0,0,0,0,1,0,0,0,0,1,0,0,0,1,0,0,0,0,1,0,0,1,0,0,0,0,1,0,0,0,0,0,1,0,0
